{
  "$schema": "../schemas/config.schema.json",
  "schema_version": "1.0.0",
  "case_name": "ACTIVSg500",
  "raw_inputs": {
    "case_file": "data/raw/matpower-8.1/case_ACTIVSg500.m",
    "case_sha256": "8ca6d54ea5179eeb03fe29d7b645618e7a86338c172247e81687476660f6dcbe",
    "contingency_file": "data/raw/matpower-8.1/contab_ACTIVSg500.m",
    "contingency_sha256": "f6b2e7e38fd1cf5e09e877cf04233b4d0487d6d0e99903070d519eade12b76a9"
  },
  "model": {
    "interval_hours": 1.0,
    "pwl_segments": 10,
    "mip_relative_gap_tolerance": 0.001,
    "model_residual_tolerance_pu": 0.000001,
    "security_violation_tolerance_pu": 0.00001,
    "lodf_validation_tolerance_pu": 1e-9,
    "lodf_validation_columns": 3,
    "lodf_build_chunk_columns": 256,
    "screen_chunk_columns": 256,
    "reduced_coefficient_zero_tolerance": 1e-14
  },
  "runtime": {
    "deadline_seconds": 600.0,
    "verification_reserve_seconds": 45.0,
    "serialization_reserve_seconds": 10.0,
    "maximum_constraint_generation_rounds": 20,
    "maximum_pdlp_round_seconds": 120.0,
    "maximum_frontier_regions": 16,
    "maximum_primal_repairs": 8,
    "maximum_primal_candidate_seconds": 15.0,
    "maximum_primal_candidate_round_seconds": 5.0,
    "minimum_primal_candidate_round_seconds": 0.25,
    "primal_candidate_stagnation_window_rounds": 2,
    "primal_candidate_minimum_relative_residual_improvement": 0.01,
    "primal_candidate_dual_divergence_multiple": 1000000.0
  },
  "platforms": {
    "dgx_spark": {
      "solver": "cuopt",
      "screening": "cupy",
      "solver_threads": 0,
      "native_scaling_mode": "power_system_per_unit_v1",
      "lp_method": "pdlp",
      "pdlp_precision": "fp64",
      "pdlp_optimality_tolerance": 1e-8,
      "dual_certificate_residual_tolerance": 1e-7,
      "per_constraint_residual": true,
      "presolve": 0,
      "lagrangian_gpu_iterations": 512,
      "lagrangian_polyak_fraction": 0.5,
      "console_logging": true,
      "integer_solver": "none",
      "branch_and_bound": false,
      "custom_cuda_kernels": "allowed_but_not_required",
      "container_image": "nvidia/cuopt@sha256:0faac7182b32f5be747e30f081427e80e8dfeccd8f49613814d3d217167fe1ad",
      "cuopt_version": "26.06.00"
    }
  },
  "benchmark": {
    "id": "activsg500-gpu-lagrangian-v3",
    "required_git_tag": "experiment-500-gpu-lagrangian-v3",
    "official": false,
    "kind": "gpu_lagrangian_disjunctive_experiment",
    "experiment_suite_id": "activsg500-gpu-lagrangian-v3",
    "certificate_safety_margin_dollars": 0.01,
    "gpu_cpu_replay_tolerance_dollars": 0.000001,
    "controller_change": {
      "comparison_baseline": "activsg500-gpu-lagrangian-v2",
      "root_certificate_persistence": "checkpoint_before_any_primal_repair",
      "candidate_budget": "15_seconds_total_with_5_second_pdlp_slices",
      "candidate_gate": "reject_dual_divergence_or_two_round_residual_stagnation",
      "candidate_queue": "root_pdlp_rounding_then_gpu_lagrangian_then_low_threshold_then_all_online",
      "global_deadline": "never_convert_deadline_exceeded_into_candidate_rejection"
    },
    "cpu_comparison": {
      "result_file": "reports/activsg500-gap-sensitivity-v1/comparison.json",
      "canonical_json_sha256": "6932e15a876c936c6263e81edcc38d09f7bb95b69725c844df8bc0446a4119a5",
      "raw_result_sha256": "d1eb3e0dc5815d55fb261b73ec42d6831e9022002c8d709e97c3f8a63091e9c0",
      "source_tag": "experiment-500-gap-v1",
      "source_commit": "6fcc0de1eb3194d7b8d1c821c03a2a0f99362e9f"
    }
  }
}
