{
  "$schema": "../schemas/config.schema.json",
  "schema_version": "1.0.0",
  "case_name": "ACTIVSg500",
  "raw_inputs": {
    "case_file": "data/raw/matpower-8.1/case_ACTIVSg500.m",
    "case_sha256": "8ca6d54ea5179eeb03fe29d7b645618e7a86338c172247e81687476660f6dcbe",
    "contingency_file": "data/raw/matpower-8.1/contab_ACTIVSg500.m",
    "contingency_sha256": "f6b2e7e38fd1cf5e09e877cf04233b4d0487d6d0e99903070d519eade12b76a9"
  },
  "model": {
    "interval_hours": 1.0,
    "pwl_segments": 10,
    "model_residual_tolerance_pu": 1e-6,
    "security_violation_tolerance_pu": 1e-5,
    "lodf_validation_tolerance_pu": 1e-9,
    "lodf_validation_columns": 3
  },
  "runtime": {
    "deadline_seconds": 300.0,
    "verification_reserve_seconds": 45.0,
    "serialization_reserve_seconds": 5.0,
    "maximum_constraint_generation_rounds": 100
  },
  "platforms": {
    "laptop_cpu": {
      "solver": "highs",
      "screening": "numpy",
      "solver_threads": 0
    },
    "dgx_spark": {
      "solver": "cuopt",
      "screening": "cupy",
      "solver_threads": 0
    }
  },
  "benchmark": {
    "id": "activsg500-v1",
    "required_git_tag": "benchmark-v1",
    "official": true
  }
}

